{"schema_version":"mindclade.feature-contract/v1","kind":"FeatureContract","metadata":{"uid":"feature-confidence-v1","created_at":"2026-08-31T12:00:00Z","producer":"feature-platform","classification":"INTERNAL"},"spec":{"semantic_identity":"feature/residue.confidence@v1","value_type":"FLOAT32","shape":[-1],"units":"probability","coordinate_frame":"sequence-index-0-based","nullable":false,"provenance":{"uri":"artifacts/specs/confidence-v1","digest":"sha256:aaaaaaaaaaaaaaaaaaaaaaaaaaaaaaaaaaaaaaaaaaaaaaaaaaaaaaaaaaaaaaaa","media_type":"application/schema+json","schema_version":"mindclade.transform-spec/v1"},"use_classification":"NON_CLINICAL_RESEARCH"},"lineage":[],"integrity":{"payload_digest":"sha256:bbbbbbbbbbbbbbbbbbbbbbbbbbbbbbbbbbbbbbbbbbbbbbbbbbbbbbbbbbbbbbbb","evidence":[]}}
